{
  "$ref": "#/definitions/logos",
  "definitions": {
    "logos": {
      "type": "object",
      "properties": {
        "name": {
          "type": "string"
        },
        "description": {
          "type": "string"
        },
        "country": {
          "type": "string"
        },
        "founded": {
          "type": "string"
        },
        "tags": {
          "type": "array",
          "items": {
            "type": "string"
          }
        },
        "website": {
          "type": "string",
          "format": "uri"
        },
        "$schema": {
          "type": "string"
        }
      },
      "required": [
        "name",
        "description"
      ],
      "additionalProperties": false
    }
  },
  "$schema": "http://json-schema.org/draft-07/schema#"
}