{
  "name": "Eurowings",
  "description": "German low-cost airline and subsidiary of Lufthansa Group, specializing in European and international leisure routes.",
  "country": "Germany",
  "founded": "6 January 1953",
  "tags": [
    "✈️ Airlines",
    "🏖️ Tour Operator"
  ],
  "website": "https://www.eurowings.com"
}
