{
    "name": "A3M Global Monitoring GmbH.",
    "description": "Travel-security and crisis-monitoring service provider that develops and operates early warning, information and communication systems for business and leisure travellers and organisations. Covers global travel risks including political unrest, natural disasters, strikes and epidemics. Based in Hamburg, Germany. :contentReference[oaicite:1]{index=1}",
    "country": "Germany",
    "founded": "2004",  
    "tags": [
      "🛡️ Travel Risk Management",
      "🌍 Crisis Monitoring"
    ],
    "website": "https://www.global-monitoring.com"
  }
  