{
  "name": "Finnair",
  "description": "Finnish flag carrier airline and one of the oldest airlines in the world still operating under its original name, founded in 1923. Known for connecting Europe with Asia via its northern route network.",
  "country": "Finland",
  "founded": "1 November 1923",
  "tags": [
    "✈️ Airlines",
    "🚚 Transportation"
  ],
  "website": "https://www.finnair.com"
}

