{
  "name": "Berge und Meer",
  "description": "German tour operator specializing in mountain and sea vacation packages. The name translates to 'Mountains and Sea'.",
  "country": "Germany",
  "tags": [
    "🏖️ Tour Operator",
    "🚚 Transportation"
  ],
  "website": "https://www.berge-und-meer.de"
}

