{
  "name": "Avata",
  "description": "Technical gateway enabling tailored insurance solutions for digital and physical asset owners. Connects insurance providers with digital citizens and the Web3 world, offering coverage for digital assets including Travel NFTs that simplify travel by consolidating itinerary details, flights, accommodations, and experiences in secure digital tokens.",
  "tags": [
    "🌐 Web3 Travel",
    "💳 Travel Tech"
  ],
  "website": "https://www.avata.gg"
}

