{
  "name": "DERTOUR",
  "description": "International travel conglomerate headquartered in Cologne, Germany. Originally founded as Deutsche Reisebüro (DER) in 1917, became DERTOUR Group in 2013 as part of REWE Group. Operates over 130 travel agencies, tour operators, booking portals, and hotel companies across 16 European countries.",
  "country": "Germany",
  "founded": "17. October 1917",
  "tags": [
    "🏖️ Tour Operator"
  ],
  "website": "https://www.dertour.de"
}
